{
  "$schema": "http://json-schema.org/draft-07/schema#",
  "title": "ValueX Firehose Env Schema",
  "type": "object",
  "additionalProperties": false,
  "properties": {
    "FIVERR_AFP": { "type": "string", "minLength": 1 },
    "FIVERR_OFFER_1": { "type": "string", "minLength": 3 },
    "FIVERR_OFFER_2": { "type": "string", "minLength": 3 },
    "FIVERR_OFFER_3": { "type": "string", "minLength": 3 },
    "AWIN_PUBLISHER_ID": { "type": "string", "minLength": 1 }
  },
  "required": [
    "FIVERR_AFP",
    "FIVERR_OFFER_1",
    "FIVERR_OFFER_2",
    "FIVERR_OFFER_3",
    "AWIN_PUBLISHER_ID"
  ]
}
