{
  "FIVERR_AFP": "VERIFY",
  "FIVERR_OFFER_1": "https://go.fiverr.com/visit/?bta=1056452&brand=fiverrmarketplace",
  "FIVERR_OFFER_2": "https://go.fiverr.com/visit/?bta=1056452&brand=fp",
  "FIVERR_OFFER_3": "https://go.fiverr.com/visit/?bta=1056452&brand=logomaker",
  "AWIN_PUBLISHER_ID": "671175"
}